id,name,property_type,accommodates,review_scores_rating
841292,BIG room in fun loft – heart of NYC,Apartment,2,91
819206,Cute shared studio apartment,Apartment,2,92
819228,MANHATTAN CONVENIENT 2 CLOSET ROOM,Apartment,2,90
841484,cozy charming apt - Lower East Side,Apartment,4,90
819270,Williamsburg Apt -Amazing Location!,Apartment,2,100
842167,1 BDR in Heart of Lower East side,Apartment,2,98
819419,Entire Private; Spacious 1-BR in Ft. Greene,Apartment,5,87
842176,Cozy Room in Williamsburg Loft Apt,Apartment,2,96
819893,MANHATTAN CONVENIENT NICE ROOM IN NYC,Apartment,1,90
819956,Home away from home;clean and cozy.,House,2,94
820146,Artist LOFT,Loft,4,98
842462,Sunny West Village 1BR,Apartment,4,90
820710,1 large bedroom w-private bath,Apartment,2,93
820801,Sunny 2BD; 2 balconies,Apartment,4,100
842494,Charming Studio Near Central Park!,Apartment,2,80
820946,CharmandQuiet in Hip Greenpt Brooklyn,Apartment,4,87
820953,Entire Apt Yours! (7 Night Minimum),Apartment,2,94
842973,Great 1 bedroom- awesome location,Apartment,2,92
821135,Bright Loft One Stop from Soho,Loft,5,98
843003,Modern 2 Bedroom Balcony Apartment,Apartment,6,97
822016,Private bedroom in beautiful; modern Brooklyn apt,Apartment,2,98
843036,Beautiful apt uptown Manhattan,Apartment,1,88
822297,2bdrm Lxury Apt Clinton Hill Bklyn,Apartment,4,
843491,Clean 1 bedroom with private bath :),House,2,97
843499,Large sunny room 10 min to Midtown!,Apartment,2,65
843524,A Little Palace in Brooklyn for Shoots and Events,Loft,6,98
823245,Cheap; Central and Cozy In Manhattan,Apartment,1,
843740,New City View Studio - Williamsburg,Apartment,2,98
843943,Fifteen minutes to Times Square!,Apartment,1,100
823520,ON HIGHLINE! Private room and bath,Apartment,2,99
844319,XL 90m2 2BR Victorian area;sleeps 7,Condominium,7,91
823618,Large;sunny private room in Harlem,Apartment,2,94
845362,Perfect 750 SF W. Village 1 Bedroom,Apartment,4,
845514,Private Room Upper East Manhattan,Apartment,2,85
823631,Bright; cozy private room in Harlem,Apartment,2,94
845517,Queen-sized Room Avail in Huge 2 bdrm-2bth loft.,Apartment,2,100
846190,Modern condo close to Prospect park,Apartment,4,97
823880,Clean Private Bedroom on Manhattan,Apartment,2,96
824163,Sunny Convienent Bushwick Room,Apartment,1,92
824421,Central Williamsburg Fab Large Room,Apartment,1,97
846275,BEST LOWER EAST SIDE- EAST VILLAGE APT; SLEEPS 4;,Apartment,4,91
825193,Park Slope Apartment ,Condominium,2,98
846457,Beatiful Studio in williamsburg,Apartment,2,95
846549,New York City Dream Apartment,Apartment,2,90
825486,1 BEDROOM APARTMENT IN UPPER EAST,Apartment,4,83
846655,Last minute - best price!,Apartment,2,93
846829,Private room in the lower east side,Apartment,2,77
846854,Large Garden Duplex on Park block,Apartment,7,99
825545,Clean cozy room central historic gay best area,Apartment,2,95
825550,Luxury Flat in Historic Brkyln Brownstone,Apartment,3,93
846857,Charming West Village Studio,Apartment,1,95
826075,Beautiful Room - Amazing Apartment!,Apartment,1,95
846871,Cozy 1 BR near Central Park; AMNH; The MET and More,Apartment,2,94
826307,Near Manhatten; NEW Empire Outlets; park!,House,2,96
826603,Brooklyn Brownstone; women only.,Apartment,2,98
847591,Brooklyn Apartment,Apartment,2,97
849703,Convenient; Renovated 2 Bedroom,Apartment,4,94
847648,Charming Apt in Historic Sugar Hill; Harlem,Apartment,2,98
850097,Beautiful 1BD in the West Village,Apartment,3,97
848087,Great light-filled 1BR in Brooklyn,Apartment,2,91
850148,1 ROOM IN AMAZING TRENDY NYC LOFT,Loft,1,95
848170,Gorgeous 1BR near Prospect Park,Apartment,4,95
850338,Authentic Luxury Designed Loft,Loft,6,96
850435,Sunny Loft in Brooklyn next to Bedford L,Loft,2,
848174,1BR East Village Apt - Entire Apt.,Apartment,2,
848220,LUXURY APT w PRIVATE GARDEN NYC UES,Apartment,3,95
848227,1 Br- Harlem-Morningside.FURNISHED,Bed and breakfast,1,
850517,3 Bedroom Duplex- 2 Baths and 2 LR,House,8,89
848707,Bright Room in Queens; Shared bath%,House,2,90
850712,Cute Studio Greenwich Village NYC,Apartment,2,90
848718,Spacious and Comfy by Prospect Park,House,2,96
850943,AMAZING TRENDY NYC LOFT,Loft,2,91
848722,★Comfy; Convenient private room★ Amazing location!,Guest suite,2,92
851130,Nice Furnished Short Term in NY,Apartment,1,96
848853,Upper Manhattan--Harlem Classic,Apartment,2,96
851241,Sunny and spacious room in Brooklyn,Apartment,2,96
849409,Spacious garden appartment brooklyn,Apartment,6,86
851772,CHIC 1 BEDROOM IN MANHATTAN (UES),Apartment,2,97
849495,HOTEL Luxury STUDIO Central Park_SH,Serviced apartment,2,70
849567,Large 1BR in Manhattan,Apartment,4,100
851784,Designer's spacious Manhattan apt.,Apartment,4,92
849603,Spacious Crown Heights Apartment,Apartment,2,88
852118,Spacious 3 Bedroom Prospect Brooklyn near subway,Apartment,6,88
852121,Large 1bdrm in Historic Harlem,Apartment,4,100
883306,1  Bedroom in Clinton Hill Share,Apartment,2,90
883423,Clean space in Carroll Gardens,Townhouse,2,94
852632,Gowanis Urban Oasis,Apartment,1,99
883480,Beautiful; large; Morningside apt,Apartment,2,97
852949,INCREDIBLY LOCATED VILLAGE APT.!,Apartment,2,97
853142,A Happy Place,Apartment,2,98
883517,3 Bedroom Upper West Side Gem,Apartment,6,96
883919,Beautiful 1Bed! Near 34st Macy's!!,Apartment,2,82
853438,2 Bedroom Loft Ceilings,Apartment,5,96
886808,Free Metrocard*; Safe and Affordable,House,1,97
853900,Immaculate brand new one bedroom ,Apartment,2,
886833,Private Suite; Free Metrocard*,Guest suite,3,94
854033,1 BR in large full floor apartment,Apartment,2,95
854037,Spacious Bedroom+Empire State view,Apartment,2,90
854182,Spacious Apartment with PATIO!!,Apartment,5,80
887129,Comfortable and Large Duplex with Private Terrace,Apartment,2,97
887292,2 Bedroom Bushwick Apartment,Apartment,6,88
854253,Great Lrg Apt next to Park-Subway,Apartment,2,60
888583,Gorgeous Greenpoint Railroad,Apartment,2,97
888905,Sunny bedroom; next to subway and Central Park,Apartment,2,93
854396,HIP BUSHWICK BK MORGANTOWN W Views,Apartment,4,84
890794,Cozy- bedroom in Jackson Heights!,Apartment,2,
854521,Room; Central Location; Priv. Entry,Apartment,1,93
855206,Bedroom with Private Bath and Roof,Apartment,2,90
855462,1BR in Charming Downtown Apt,Apartment,2,99
890855,Sun-Drenched Studio in Clinton Hill,Apartment,2,93
891117,Private Bedroom Manhattan ♥♥♥♥♥,Apartment,2,88
855542,Large Furnished Bedroom,Apartment,2,
892463,Ideal Location + Shower In Kitchen!,Apartment,2,98
892704,Enjoy Brownstone Brooklyn!,Apartment,4,90
855549,Have the 1st floor of a two floor duplex;,Apartment,1,94
855573,Beautiful Studio in Manhattan near Central Park,Apartment,3,80
893413,Magnificent Townhouse; Once a Synagogue,Townhouse,10,97
855919,Lovely Apt. in the heart of Harlem,Apartment,4,95
856440,YOUR OWN PLACE WITH VIEWS OF CENTRAL PARK,Apartment,2,93
856918,Large Room in Garden Duplex  ,Apartment,3,90
893556,Best Deal in Hells Kitchen-Midtown!,Apartment,1,92
857696,PRIVATE LARGE-MODERN-CLEAN master bedroom,House,1,
858223,Entire flat west village,Loft,2,92
858695,Very Large Private Room on quiet st,Apartment,3,92
859023,Charming Artist's Home in Brooklyn,Apartment,5,89
893853,Best Location btwn Un Sq- Chelsea,Apartment,2,98
859596,1 room with good light  in Upper East Side apt,Apartment,2,92
894015,Boldera: Your Home Away From Home,Apartment,6,95
860163,Manhattan Studio Apartment: 2 Adults $125,Bed and breakfast,2,95
860401,Lovely 2 Bed Garden Apt Fort Greene,Apartment,4,95
860827,carriage house apartment,Apartment,4,95
894063,Penthouse patio;city view;BIG bed,Apartment,2,95
861325,Modern UWS Apt Near Central Pk,Apartment,1,97
894093,Cozy room;only 2 blocks from subway;10min to City!,Apartment,2,93
862638,West Village- PERFECT; Central and Quiet-1 Bedroom,Apartment,2,97
895368,Large 2 bedroom apt in Manhattan,Apartment,3,
895386,THE BEST: Apt in Manhattan-Harlem-Private RoomS!!,Apartment,7,95
898534,Light and Airy; Prime Williamsburg,Apartment,3,89
898669,Hip Modern West Village Apartment,Apartment,3,93
862890,Private bedroom w- king size bed + pvt bathroom,Apartment,2,100
898861,Private One Bedroom Suite; 45 min from City,Apartment,3,98
900383,Brooklyn-Bedstuy-1 bedroom,Apartment,4,92
900503,Stylish 1897 garden duplex oasis!,Apartment,2,
901664,Furnished 1 bedroom (Hells Kitchen),Apartment,2,92
901934,Amazing Williamsburg Apt Share!,Apartment,1,100
902482,Modern E. Village 2BR w-Roof Deck,Apartment,4,94
903906,charming house on family block,House,6,100
903947,Beautiful Bedroom Manhattan ♥♥♥♥♥,Apartment,2,88
863209,Warm and Inviting Apartment (Private),Apartment,2,93
904060,Beautiful Modern apt in Brooklyn,Apartment,3,95
904470,Big Lovely Chelsea Studio! Sleeps 5,Apartment,5,89
905314,Wlk 2 Columbia Duplex Penthouse by metro and C Park,Apartment,1,83
905425,PAINTERS PARADISE - GREENPOINT,Loft,2,97
863225,GuestRoom w-Bath~15 Min to Midtown,Apartment,2,97
905694,Huge Sun-Drenched W. Village w- Balcony,Condominium,2,100
864790,PEACEFUL SHARE BY CENTRAL PARK,Apartment,1,97
905947,CHIC ROOM IN BROOKLYN BROWNSTONE,House,1,93
864981,Cozy Room in Charming Brownstone,Apartment,1,99
865355,Spacious and Comfortable Room!,Apartment,2,86
866890,Budget-diamond in heart of Harlem,Apartment,1,96
906038,Central Pk West-Convenient 1 BR,Apartment,2,94
867020,Nice quiet room on a backyard,Apartment,1,96
867069,Private Garden Apt on Eastern Pkwy,Apartment,4,93
906058,Columbia area room pvt bath and entry,Apartment,2,97
867717,A Bright; Fun; Artist Conservatory,Apartment,4,
867721,Comfortable Modern Room in Bed-Stuy,Apartment,2,93
906829,Studio apartment in Bensonhurst ,House,2,
867749,Sunny 2 bedroom in Prospect heights + terrace,Condominium,4,100
906988,Bed Stuy Garden Floor Apt,Apartment,4,
867769,Full Bedroom in Bed-Stuy,Apartment,2,93
907966,1 rm @ 3BR artist loft williamsburg,Loft,2,95
868548,Friendly and fun w- private terrace,Apartment,2,90
868874,Modern townhouse duplex Brooklyn -Prospect Heights,House,7,98
908046,1150$furnished room with a balcony,Apartment,2,
869522,Private room-Upper Manhattan,Apartment,1,90
869615,Welcome to the LES!,Apartment,2,89
870119,Beautiful 2bdrm Bklyn duplex w-deck + backyard,Townhouse,5,90
908640,Lovely 1 bedroom in Gramercy area,Apartment,3,95
908923,Charming East Village Studio,Apartment,2,60
870727,Gorgeous huge loft in Bushwick,Loft,3,95
871076,LARGE 2 BR w-Dining Room; Balcony; Echo,Apartment,4,92
909859,charming luxurious house; NY; Brooklyn,House,8,100
872035,furnished bedroom 1150$ a month,Apartment,2,
872069,Williamsburg One Bedroom,Apartment,2,82
910730,Private 1br Apartment in Williamsburg!,Apartment,3,93
872210,Quiet 1BR Heart of the East Village,Apartment,1,
911092,Avenue A Apartment,Apartment,4,91
872314,2 Beds Option + Roof Deck; Sunshine Bushwick,Apartment,2,98
911191,Park Front Apartment; Easy Access to Manhattan,Apartment,2,93
873465,Cute and Comfortable One Bedroom,Apartment,3,89
912376,Room in cool Bushwick loft!,Loft,2,60
873701,Chic; quiet 1BR with patio (steps from the subway),Apartment,4,95
913816,Gorgeous Waterfront Luxury Apt!,Apartment,6,97
873721,Sunny; large room near Central Park,Apartment,2,96
914594,Perfect for NYC stay! COZY STUDIO w- WASHER-DRYER,Apartment,2,96
874683,Spacious Bushwick Duplex Apartment,Loft,1,94
915020,Garden Apartment in Park Slope,Guest suite,3,97
874706,Fully Updated Modern 1 Bedroom Apartment,Apartment,3,94
916311,Rooms in Spacious East Village Apt.,Apartment,3,100
918049,Union Sq European Serene apt,Apartment,2,94
875036,The Stylish Boutique W.Village Apt,Apartment,2,95
875189,Very nice studio in West Village,Apartment,1,96
919491,Park Slope Private Bed+Livingroom!,Apartment,4,94
875362,Elegant 3 Bedroom in Brooklyn-2 bathroom,Apartment,10,92
919830,1br in a 2br apartment in Chelsea (23-7),Apartment,2,95
875460,Designer apartment near Central Park and the subway,Apartment,2,95
876355,Large 1BR Columbia University,Apartment,2,100
919978,2bdrm + Patio-BackYard-Time Square-1st Floor,Apartment,6,90
876565,Spacious Comfy Bedroom in Bed-Stuy,Apartment,2,90
877135,Williamsburg 1br APT,Apartment,2,94
919990,2 Bedroom Apt in Caroll Gardens,Apartment,4,100
920930,Backyard BBQ in Brooklyn Brownstone,Apartment,4,83
921441,Artsy Bedroom-Office in WaHi,Apartment,2,97
921585,Cosmopolitan Brownstone Sanctuary,House,8,93
878142,Serene 1BR+Garden+Goldfish Pond+Cook's Kitchen,Apartment,2,100
880102,Beautiful Williamsburg Apartment,Apartment,3,100
921624,Rare W'burg Quiet Spacious Duplex Loft Bedford L,Loft,4,92
880424,★Beautiful Home Away From Home★,Apartment,1,98
921695,Furnished Bedroom with private Bathroom.,House,1,93
880642,Apartment in Harlem-w park views,Apartment,3,84
921862,Breathtaking view of New York city,Apartment,4,93
882209,Gorgeous Williamsburg Apartment,Apartment,2,92
922764,Top Floor 2bd Luxury Brownstone Apt,House,6,94
882559,Private bedroom and bathroom in a nice duplex,Apartment,2,98
923327,West Village Studio with Queen Bed,Apartment,3,90
883209,World Travelers to Couchcrash in BK,Apartment,1,87
923566,Sunlit Central Park Apartment,Apartment,4,92
928229,Cozy Private Room in the Center NYC,Apartment,1,87
929032,Dumbo | Spacious private room w- private bathroom,Apartment,2,87
923722,PermaGO Bunk Bed in City Hall Shared Room!,Apartment,1,95
923725,Gorgeous PermaGO Private Room  in City Hall  - 1-2,Apartment,4,96
931352,Lovely Private Room in Bushwick! :),Apartment,2,
931642,Murray Hill Garden Apt. MANHATTAN,Apartment,2,96
932277,Fabulous Industrial Dumbo Loft,Loft,2,96
923729,PermaGO Bunk Bed in City Hall Shared Room@,Apartment,1,99
933129,Fort Greene Jewel,Apartment,2,98
933861,Hell's Kitchen Hideaway - Private Entrance,Apartment,1,97
923979,Private Studio Near JFK; LGA and Subway Station,Guesthouse,2,96
936001,Gorgeous One Bedroom Apartment ,Apartment,4,
936218,Clean-Furnished Room Near The Apollo (W 125th St.),Apartment,1,100
924600,Sunny; private room in Brooklyn!,Apartment,1,95
937306,LUX; VIEW OF HUDSON; RELAXING FOR BUSY PEOPLE,Condominium,2,100
938022,Private Bedroom in Williamsburg,Apartment,2,97
939657,Behind the Red Door II ,Apartment,4,94
939724,Stylish Room-Artist-Designers' Flat,Apartment,2,86
924658,Bright; airy room share in Brooklyn,Apartment,1,94
925010,SoHo Suites with Shared Bathroom,Serviced apartment,2,90
940115,Cozy Studio in the Heart of Crown Heights,Apartment,2,89
940116,Bright Room in Historic Brownstone,Apartment,1,99
925075,Sunny Loft Style Apt-Great Location,Apartment,3,94
925137,Cute Manhattan Chelsea Apartment,Apartment,1,100
940794,Chic apt in heart of hip Brooklyn!,Apartment,4,
925240,Artist Loft - Union Square,Loft,2,96
941165,Private Room in sunny; spacious pad,Apartment,1,87
941179,Awesome Brooklyn 1 Bedroom,Apartment,2,98
941625,UWS W-Terrace Wlk to Central Park and Columbia Uni,Apartment,1,90
925730,Large studio all to yourself,Apartment,2,90
926337,Charm w-amazing city view by PS1,Apartment,2,94
927408,Large Cozy Room #1; Landmark Home 1 block to PRATT,Townhouse,3,89
941642,HELL'S KITCHEN STUDIO for 2 or 3,Apartment,3,92
927597,(2) CLEAN HOME AWAY FROM HOME!,Apartment,2,94
944040,Entire 1.5 Br Apt- Crown Heights - Franklin Ave,Apartment,3,95
927987,Bright Doorman One Bedroom on Upper East Side,Apartment,2,95
944049,Beautiful 1BR in Prime West Village,Apartment,2,95
944183,your holiday-ready Harlem home away from home!,Apartment,6,100
990130,Spacious 3br Apartment in Brooklyn,Apartment,5,92
990208,*MONTHLY RENTAL* Private Studio; Ideal Location,Apartment,2,94
990367,Colorful Manhattan - Harlem Apartment,Apartment,4,84
990529,Sunny Luxury Bedroom Guest Bathroom,Apartment,2,93
990703,Cozy room famous Park Ave in Manha!,Apartment,4,88
992508,Next to Subway; Private bedroom,Apartment,2,92
992598,Village Life; 2-Bedroom; East Village,Apartment,5,94
944755,STUDIO APT 1. IN PROSPECT LEFFERTS GARDENS,Apartment,2,94
992891,Sunny Nolita 1 Bedroom Apartment,Apartment,2,96
944840,Dumbo Loft With A Beautiful View,Loft,2,92
992977,Park Slope Pre-War Apartment,Apartment,2,94
945297,East Village Gay Friendly Dbl Room,Apartment,2,94
946644,Your own luxurious private floor in my duplex apt,Apartment,5,92
947810,Seeking Short Term Roommate on UES,Apartment,1,87
993040,YOUR HARLEM HOME AWAY FROM HOME!!! ,Apartment,4,87
947963,Sunny WILLIAMSBURG Room near SUBWAY,Apartment,1,98
949159,Sunny large 1-bedroom apartment near Prospect Park,Apartment,2,100
993514,Luxury Furnished 1 BR UWS Apt w W-D and Deck,Apartment,3,94
949713,Luxury Duplex Loft w. Private Roof and Amazing Views,Loft,4,95
993575,1 BR Large Luxury Furnished Apartment UWS,Apartment,3,98
950811,Room in Gorgeous West Village Apt,Apartment,1,
993576,Luxury Furnished 1 BR Apartment  UWS,Apartment,3,95
951365,Bushwick-Ridgewood aprtmt w parking,House,2,94
995169,West Village Gem,Apartment,3,96
951944,Quiet Studio in Prime SoHo,Apartment,2,97
953275,Apartment For Your Holidays in NYC!,Apartment,4,93
995187,BIG and SUNNY; 1 STOP FROM MANHATTAN,Apartment,6,92
953314,Brownstone In Midtown Manhattan,Apartment,12,92
995215,Upper West Side Amazing Large 2 Bedrooms,Apartment,4,100
953746,Quiet Clinton Hill Studio,Apartment,2,93
995469,Beautiful Large Furnished Bedroom on UES,Apartment,1,
997173,Times Sq-Midtown -Hell's Kitchen: Private Bedroom,Apartment,2,95
997404,Charming Apt. In Brooklyn Townhouse,Apartment,4,95
953951,West Village Large 1BR,Apartment,3,96
955153,Elegant loft in heart of soho,Apartment,2,100
998312,Room with private half-bath,Condominium,2,80
955542,Garden Duplex*Sunny Master BD*,House,2,92
998423,Great space minutes from Manhattan!,Apartment,1,99
998981,Hell's Kitchen Hub - 1 bed 1 bath,Apartment,2,98
956412,Charming Bright 2BR apt- sleeps 6,Apartment,6,94
957002,Cozy PRIVATE Studio Apartment UWS and Jazz Tour.,Apartment,2,85
999248,TriBeCa 2500 Sq Ft w- Priv Elevator,Loft,10,98
958444,Great 1BD waterfront City Island NY,Apartment,3,97
999977,Cozy studio apartment on upperwest,Apartment,2,
959349,Modern New Duplex with Private Yard,Apartment,4,92
999984,Greenwich Village Townhouse Apt,Apartment,3,94
959478,Chic; Cozy LES 1BR. Weekly clean included!,Apartment,2,89
959788,Private Exposed Brick Room in SoHo,Apartment,2,95
959791,Sunny; Large Beautiful true 1-Bdrm!  Great price!,Apartment,2,97
1000788,Modern Lux 1 br near 2-3-4-5 Trains,Apartment,2,100
959871,Bask in the light! Studio bedroom in Williamsburg,Apartment,2,97
1000995,2 Bedroom Overlooking Prospect Park,Apartment,4,100
960210,Brooklyn Fashionista 1Bdr Loft,Apartment,2,94
1001147,Big Room with Bath in Bushwick! ,Apartment,2,97
1001447,Comfy sofa- Cosy apartment- East Harlem - Subway,Apartment,1,96
961477,Great 1 Bedroom,Apartment,3,89
1002469,Comfortable Apt near Bloomingdales,Apartment,3,96
962045,Private Room and Coffee; only 3 blocks to Train,Apartment,2,92
964379,WATER VIEWS 3 BED HOME W- PARKING,House,6,95
1003754,Chic Fully Equipped Park Slope Pied-à-terre,Apartment,3,97
966104,Private room in large 2 bed room,Apartment,2,93
1005416,South Harlem Gem! 113th St and 8th Ave,Apartment,2,94
1005763,★Private Room Overlooking the Park★,Apartment,2,97
1009883,Modern; Carroll Garden Townhouse,Townhouse,4,100
969533,Large Private room in UWS apartment,Apartment,1,92
1010785,Astoria awesome balcony apartment PARKING AVAILABL,House,2,97
1011449,Spacious and EASY access to all!,Apartment,5,95
1013648,Gorgeous 2 Fl Apt in1887 Brownstone,Apartment,5,98
1014313,Private Room in Bellerose; Queens,House,1,86
1016004,Clean and Cute Shared Room in Very Safe Area,Apartment,2,98
1016105,BK - Spacious and Sunny 4 bedroom apartment,Apartment,6,100
1016352,Midtown West Modern and Sunny-near Central Park,Apartment,2,
970302,Sunny and Stylish Brooklyn Flat,Townhouse,5,91
1016819,2BR 2Bath duplex w garden and Terrace,Loft,4,95
970715,Private 1br;1ba Apt. Comfy + Quiet,Apartment,4,93
1018529,Large 2 BDRM @ McCarren Park!!,Apartment,4,99
971158,Sunny room with private bathroom,Apartment,2,99
1019360,Hip charming Williamsburg apartment,Apartment,3,97
971233,Elegant and Quiet | Airbnb Walk + Transit score 100,House,2,84
1021491,Whole Apt: Artsy home by BK Museum,Apartment,2,80
1022204,Glowing reviews; hip neighborhood,Apartment,2,98
1023452,Amazing 3BR windows in all rooms,Apartment,3,
971247,Sunny Artist Live-Work Apartment,Apartment,3,97
973128,Pretty One Bed in Brooklyn Heights,Apartment,3,94
1023529,Convenient and private,Apartment,1,94
1024364,The Perfect East Village-Grammercy Apt,Apartment,2,96
973535,Garden Apt; 5 mins from LaGuardia,Apartment,4,91
973653,A true Sanctuary in Harlem NYC,Apartment,3,
1025001,Private Entrance Charming Bedroom,House,2,98
975229,Prime East Village location w-backyard garden!,Apartment,2,97
1025786,Fantastic 1br in Astoria-LIC,Apartment,1,84
975250,Bushwick Duplex 2,Apartment,1,96
975965,Great Room in Lively East Village,Apartment,2,98
975990,Brooklyn Heights Brownstone - Private Bdrm Avail.,Apartment,2,76
1026531,New building; sunny - whole apt in Williamsburg,Apartment,2,92
976167,Newly Furnished Beautiful and Quiet,Apartment,3,92
976242,Cozy East Village Haven,Apartment,4,89
1026565,Peaceful Park Slope near subways,Apartment,3,96
978062,West Village 1 BR Apartment,Apartment,2,100
978386,A GEM Garden Apt on Broadway and 42ST QUEENS; NY,Apartment,2,87
1026683,Mi Casa Tu Casa Guesthouse Mexico ,Bed and breakfast,2,98
978582,Tiny Noisy Clean Upper East Side Apt,Apartment,3,94
1026945,Mi Casa Tu Casa Guesthouse a home away from home.,House,2,20
1026992,Mi Casa Tu Casa Guesthouse,Bed and breakfast,4,100
978615,NICE ROOM IN ASTORIA NEAR MANHATTAN,House,4,90
1027162,Mi Casa Tu Casa Guesthouse,Bed and breakfast,2,100
1027808,East Village Loft - 1300 sq-ft home - 2 Bedrooms!,Loft,5,97
1028263,Spacious Room-Great Location,Apartment,1,82
980098,Quiet ST MARK'S PLACE ARTIST'S GEM,Apartment,2,96
1028366,1 great room available East will.,House,1,
980637,New York City - Greenwich Village Apt,Apartment,2,92
981494,Large and sunny one BR (600 sq.ft),Apartment,4,
1029118,Great; Sunny; Large; Studio Apt NYC,Apartment,2,96
982038,Entire 1bdrm cnr of Fort Greene- off Park,Apartment,2,100
982188,Close to Subway Prime Williamsburg,Apartment,2,96
1029482,Private Room w TV in East Village,Apartment,1,91
982276,*Perfect Bedroom! Large Sunny Apt*Manhattan*NYC,Apartment,1,97
983625,Great Studio in the heart of Harlem,Apartment,2,93
1029808,Spacious 1bd Near Trendy Neighborhoods And City,Apartment,2,88
1030254,Large room in Beautiful communal house,Apartment,1,97
984721,QUIET GARDEN APT FACING NY BAY!,House,2,92
985338,6 month sublet from May  Bklyn.Hts,Apartment,2,
1030780,NYC Brooklyn Sunset Park- Great Bed. Great House.,Townhouse,1,91
985642,Charming and Cozy Bushwick Apartment,Apartment,2,90
1032127,Short Term Stay in Chelsea-MP NYC,Apartment,2,
986727,Manhattan's Best Deal!,Apartment,6,91
987049,Spacious 2 Bedroom in UES All Yours,Apartment,8,83
1032610,Beautiful loft in trendy Harlem!,Loft,2,100
1032611,Private 1 bdrm Lefferts Gr; BK apt,Apartment,4,93
987329,ROOM NEAR TIMES SQUARE MANHATTAN,House,3,90
987616,5 Bdrm Historic Brownstone Triplex,Apartment,8,92
1034911,Entire Spaceous; Sunny; Loft in Clinton Hill,Loft,5,98
1036498,☆☆New Discount☆☆ 10min to Manhattan,Apartment,1,91
989976,Three Bedroom NY Private Apartment,Apartment,7,94
1049224,Beautiful duplex in a brownstone,Apartment,7,89
1036734,Apartment in the heart of Upper East Side,Apartment,2,94
1051575,Quiet and Comfort Near Columbia University,Apartment,2,96
1038326,Cute and Modern Apartment in Harlem!,Apartment,2,93
1053523,Beautiful Ground Level Townhouse Ap,Apartment,4,97
1039215,Heart of Williamsburg - authentic and central!,Apartment,2,95
1054201,One Bedroom Townhouse Apartment,Apartment,3,95
1055029,Washington Heights-Inwood apartment,Apartment,2,91
1056119,Cozy Private Space in Williamsburg Townhome,Guest suite,2,90
1039435,Lovely studio in Manhattan;New York,Apartment,2,100
1056185,Sunny+Cozy Double bedroom in BKLYN!,Apartment,2,96
1056256,Beautiful eco triplex w-green roof. Free yoga-spa.,House,12,94
1039946,Hilton Grand Vacation Condo-Studio,Apartment,2,
1056445,Upscale Designer Studio-Heart of Manhattan,Apartment,2,88
1040156,2 floor Luxury Loft in the best location!,Serviced apartment,6,98
1056804,Spacious Modern and Comfy Brownstone 2BRs,Apartment,7,98
1041334,Quiet central Williamsburg Loft,Apartment,6,94
1042416,Sunny Brownstone  Attic,Townhouse,5,90
1056865,Cozy Apt x Rent Close to Manhattan,Apartment,2,98
1057022,Spacious 1br East Village Apartment,Apartment,2,90
1042806,My Other Little Guestroom,House,2,94
1059025,Spacious Studio with Parking,Apartment,3,85
1059531,Staten Island 1st floor Apartment,Apartment,5,
1043046,Studio in Best Possible Location!,Apartment,2,98
1044502,HELLO HARLEM,Apartment,6,95
1059891,PRIVATE BEDROOM,Apartment,2,98
1044731,Dear Potential Airbnb Guests.,Apartment,2,95
1060019,Modern Duplex 1 bdrm ; 1.5 Baths + terrace!,Condominium,4,97
1061337,Sunny Private BR Crown Hts Brooklyn,Apartment,2,87
1063014,Fabulous Brooklyn Apartment Share,Apartment,2,100
1045491,Prime Williamsburg. Brand new,Apartment,1,93
1045897,HISTORIC WILLIAMSBURG; BKLYN,Apartment,5,89
1063020,Private Brownstone,Townhouse,2,97
1046443,Beautiful and spacious apartment in Astoria; Queens,Apartment,2,97
1063119,Uptown 2 Bedroom Haven in New York City!,Apartment,4,100
1046615,Great converted LOFT; STUDIO APT.,Loft,2,96
1048190,Huge Sunny Loft w Patio + Charm,Loft,5,98
1065138,Private room in beautiful neighborhood in Brooklyn,Apartment,2,100
1066769,Clean Room; Central Location in Manhattan,Apartment,2,97
1066779,Best of SOHO Gorgeous 2 bedroom,Condominium,5,89
1107092,Brand new 2BD Apt in Gramercy,Condominium,4,98
1067251,Entire home-apt in New York,Apartment,6,
